{
  "name": "fdsi-live",
  "prefix": "fdsi",
  "brand": "core",
  "area": "sb",
  "displayName": "Live",
  "description": "Live event/broadcast icon.",
  "tags": [
    "live",
    "streaming",
    "broadcast"
  ],
  "aliases": [],
  "status": "active",
  "deprecatedInFavorOf": null,
  "variants": [
    {
      "size": "reg",
      "style": "outline",
      "file": "fdsi-live-reg-outline.svg"
    },
    {
      "size": "reg",
      "style": "solid",
      "file": "fdsi-live-reg-solid.svg"
    }
  ],
  "figma": {
    "nodeId": "3:183",
    "componentKey": "2a5f0f0e03c143b0faa9bd4db818d7ea6456fcc5",
    "lastSyncedHash": "5a3ab565f19ad8c8",
    "lastSyncedAt": "2026-10-05T15:05:53.304Z"
  },
  "version": "0.1.0",
  "createdAt": "2026-09-18",
  "updatedAt": "2026-10-05"
}
