{
  "$schema": "../../../registry/schema/icon.meta.schema.json",
  "name": "fdsi-home",
  "prefix": "fdsi",
  "brand": "core",
  "area": "global",
  "displayName": "Home",
  "description": "Home tab icon.",
  "tags": [
    "home",
    "nav"
  ],
  "aliases": [],
  "status": "active",
  "deprecatedInFavorOf": null,
  "variants": [
    {
      "size": "reg",
      "style": "outline",
      "file": "fdsi-home-reg-outline.svg"
    },
    {
      "size": "reg",
      "style": "solid",
      "file": "fdsi-home-reg-solid.svg"
    }
  ],
  "figma": {
    "nodeId": "19:1458",
    "componentKey": null,
    "lastSyncedHash": "d5e3c0c0afdec8e8",
    "lastSyncedAt": "2026-09-18T13:22:34.421Z"
  },
  "version": "0.1.0",
  "createdAt": "2026-09-18",
  "updatedAt": "2026-09-18"
}
