{
  "$schema": "../../../registry/schema/icon.meta.schema.json",
  "name": "fdsi-betslip",
  "prefix": "fdsi",
  "brand": "core",
  "area": "sb",
  "displayName": "Betslip",
  "description": "Betting slip icon.",
  "tags": [
    "betslip",
    "bet",
    "ticket"
  ],
  "aliases": [],
  "status": "active",
  "deprecatedInFavorOf": null,
  "variants": [
    {
      "size": "reg",
      "style": "outline",
      "file": "fdsi-betslip-reg-outline.svg"
    },
    {
      "size": "reg",
      "style": "solid",
      "file": "fdsi-betslip-reg-solid.svg"
    }
  ],
  "figma": {
    "nodeId": "1:65",
    "componentKey": "dd6dc0e5fa25e6d96bd573f59f92aac82fd16206",
    "lastSyncedHash": "b64ad6948fa4da88",
    "lastSyncedAt": "2026-09-29T07:37:10.280Z"
  },
  "version": "0.1.0",
  "createdAt": "2026-09-18",
  "updatedAt": "2026-09-18"
}
