{
  "name": "fdsi-explore",
  "prefix": "fdsi",
  "brand": "core",
  "area": "global",
  "displayName": "Explore",
  "description": "Explore/discover icon.",
  "tags": [
    "explore",
    "discover",
    "categories"
  ],
  "aliases": [],
  "status": "active",
  "deprecatedInFavorOf": null,
  "variants": [
    {
      "size": "reg",
      "style": "outline",
      "file": "fdsi-explore-reg-outline.svg"
    },
    {
      "size": "reg",
      "style": "solid",
      "file": "fdsi-explore-reg-solid.svg"
    }
  ],
  "figma": {
    "nodeId": "1:20",
    "componentKey": "3b3ed21f1fc676c0e3dd9bc34e249c123565f777",
    "lastSyncedHash": "07d19e974137c741",
    "lastSyncedAt": "2026-10-05T13:54:00.868Z"
  },
  "version": "0.1.0",
  "createdAt": "2026-09-18",
  "updatedAt": "2026-10-05"
}
