{
  "$schema": "../../../registry/schema/icon.meta.schema.json",
  "name": "fdsi-my-games",
  "prefix": "fdsi",
  "brand": "core",
  "area": "gx",
  "displayName": "My Games",
  "description": "User's games icon.",
  "tags": [
    "my-games",
    "games",
    "account"
  ],
  "aliases": [
    "fdsi-my_games"
  ],
  "status": "active",
  "deprecatedInFavorOf": null,
  "variants": [
    {
      "size": "reg",
      "style": "outline",
      "file": "fdsi-my-games-reg-outline.svg"
    },
    {
      "size": "reg",
      "style": "solid",
      "file": "fdsi-my-games-reg-solid.svg"
    }
  ],
  "figma": {
    "nodeId": "20:40",
    "componentKey": null,
    "lastSyncedHash": "ad27606356f24301",
    "lastSyncedAt": "2026-09-18T13:55:54.262Z"
  },
  "version": "0.1.0",
  "createdAt": "2026-09-18",
  "updatedAt": "2026-09-18"
}
