{
  "$schema": "../../../registry/schema/icon.meta.schema.json",
  "name": "fdsi-live-casino",
  "prefix": "fdsi",
  "brand": "core",
  "area": "gx",
  "displayName": "Live Casino",
  "description": "Live casino icon.",
  "tags": [
    "live-casino",
    "casino"
  ],
  "aliases": [
    "fdsi-live_casino"
  ],
  "status": "active",
  "deprecatedInFavorOf": null,
  "variants": [
    {
      "size": "reg",
      "style": "outline",
      "file": "fdsi-live-casino-reg-outline.svg"
    },
    {
      "size": "reg",
      "style": "solid",
      "file": "fdsi-live-casino-reg-solid.svg"
    }
  ],
  "figma": {
    "nodeId": "1:57",
    "componentKey": "d1c958176fa07325f1e416ad3b45b770c6f9373c",
    "lastSyncedHash": "84628f5d39455a1f",
    "lastSyncedAt": "2026-09-28T09:13:34.045Z"
  },
  "version": "0.1.0",
  "createdAt": "2026-09-18",
  "updatedAt": "2026-09-18"
}
